{
  "improvements": {
    "priority_additions": [
      {
        "from": "Community Participation",
        "to": "Experienced Contributors",
        "relationship": "positive",
        "rationale": "Wenger's Communities of Practice theory emphasizes that sustained participation transforms peripheral members into core practitioners through legitimate peripheral participation",
        "expected_impact": "Captures the essential community maturation process missing from current model"
      },
      {
        "from": "Shared Practice",
        "to": "Community Identity",
        "relationship": "positive",
        "rationale": "Core to CoP theory - mutual engagement in joint enterprise creates shared repertoire and collective identity",
        "expected_impact": "Models the social fabric that sustains community engagement beyond technical contributions"
      },
      {
        "from": "Mentoring Activities",
        "to": "New Contributors Retention",
        "relationship": "positive",
        "rationale": "Legitimate peripheral participation requires guidance from experienced members to facilitate learning and integration",
        "expected_impact": "Addresses the critical onboarding process that determines long-term contributor sustainability"
      },
      {
        "from": "Tacit Knowledge Sharing",
        "to": "Explicit Knowledge Creation",
        "relationship": "positive",
        "rationale": "Nonaka's SECI model emphasizes socialization (tacit-tacit) enables externalization (tacit-explicit) through dialogue and collective reflection",
        "expected_impact": "Corrects the zero-sum misconception and models knowledge creation as complementary processes"
      }
    ],
    "recommended_removals": [
      {
        "from": "Explicit to Implicit Conversion",
        "to": "Projects's Explicit Knowledge",
        "reason": "Contradicts Wenger's view that knowledge conversion is complementary, not zero-sum. Explicit and tacit knowledge should reinforce each other in a virtuous cycle"
      },
      {
        "from": "PR Review Delay",
        "to": "PR Feedback",
        "reason": "Unsupported by theory - delays typically hinder legitimate peripheral participation by creating barriers to engagement and learning"
      },
      {
        "from": "Knowledge Conversion Rate",
        "to": "Projects's Explicit Knowledge",
        "reason": "Oversimplifies knowledge dynamics - conversion involves complex social processes beyond simple accumulation"
      }
    ],
    "new_variables_needed": [
      {
        "name": "Community Identity Strength",
        "type": "stock",
        "purpose": "Represents the collective sense of belonging and shared purpose within the community",
        "connects_to": [
          "Shared Practice",
          "Community Participation",
          "Contributor Retention",
          "Knowledge Sharing Willingness"
        ]
      },
      {
        "name": "Legitimate Peripheral Participation",
        "type": "flow",
        "purpose": "Models the process where newcomers gradually move from periphery to core through guided participation",
        "connects_to": [
          "New Contributors",
          "Mentoring Activities",
          "Community Participation",
          "Experienced Contributors"
        ]
      },
      {
        "name": "Ba (Knowledge Creation Context)",
        "type": "auxiliary",
        "purpose": "Represents the shared context for knowledge creation as per Nonaka's theory - the physical, virtual, and mental spaces where knowledge is shared",
        "connects_to": [
          "Community Participation",
          "Knowledge Sharing",
          "Tacit Knowledge Sharing",
          "Explicit Knowledge Creation"
        ]
      }
    ],
    "structural_changes": [
      {
        "change": "Replace linear knowledge conversion with Nonaka's SECI spiral model structure",
        "justification": "Knowledge creation should be modeled as a dynamic spiral where socialization, externalization, combination, and internalization reinforce each other"
      },
      {
        "change": "Add feedback loop: Community Identity \u2192 Shared Practice \u2192 Community Participation \u2192 Community Identity",
        "justification": "Wenger's theory emphasizes the reciprocal relationship between practice, community, and identity formation"
      },
      {
        "change": "Restructure contributor progression: New Contributors \u2192 Legitimate Peripheral Participation \u2192 Community Participation \u2192 Experienced Contributors",
        "justification": "Better represents the trajectory of learning and participation described in Communities of Practice theory"
      }
    ],
    "implementation_order": [
      "Step 1: Add Community Identity and Legitimate Peripheral Participation variables",
      "Step 2: Implement the three priority addition connections with proper feedback loops",
      "Step 3: Remove problematic connections and restructure knowledge conversion processes",
      "Step 4: Add Ba variable and integrate SECI model structure",
      "Step 5: Validate revised model against Communities of Practice and SECI theoretical principles"
    ],
    "expected_improvement": "Model alignment with theory should improve from 5.5/10 to 8.5/10 by properly capturing the social learning dynamics, knowledge creation processes, and community identity formation central to both Communities of Practice and SECI theories. The revised model will better represent how open-source communities actually develop and sustain themselves over time."
  },
  "implementation_script": {
    "additions": [
      {
        "command": "Add connection: Community Participation \u2192 Experienced Contributors (positive)",
        "mdl_fragment": "Experienced Contributors = A FUNCTION OF(..., Community Participation)",
        "rationale": "Wenger's Communities of Practice theory emphasizes that sustained participation transforms peripheral members into core practitioners through legitimate peripheral participation"
      },
      {
        "command": "Add connection: Shared Practice \u2192 Community Identity (positive)",
        "mdl_fragment": "Community Identity = A FUNCTION OF(..., Shared Practice)",
        "rationale": "Core to CoP theory - mutual engagement in joint enterprise creates shared repertoire and collective identity"
      },
      {
        "command": "Add connection: Mentoring Activities \u2192 New Contributors Retention (positive)",
        "mdl_fragment": "New Contributors Retention = A FUNCTION OF(..., Mentoring Activities)",
        "rationale": "Legitimate peripheral participation requires guidance from experienced members to facilitate learning and integration"
      },
      {
        "command": "Add connection: Tacit Knowledge Sharing \u2192 Explicit Knowledge Creation (positive)",
        "mdl_fragment": "Explicit Knowledge Creation = A FUNCTION OF(..., Tacit Knowledge Sharing)",
        "rationale": "Nonaka's SECI model emphasizes socialization (tacit-tacit) enables externalization (tacit-explicit) through dialogue and collective reflection"
      }
    ],
    "removals": [],
    "new_variables": [
      {
        "command": "Create variable: Community Identity Strength",
        "mdl_fragment": "Community Identity Strength = A FUNCTION OF(Shared Practice, Community Participation, Contributor Retention, Knowledge Sharing Willingness)",
        "type": "stock",
        "purpose": "Represents the collective sense of belonging and shared purpose within the community"
      },
      {
        "command": "Create variable: Legitimate Peripheral Participation",
        "mdl_fragment": "Legitimate Peripheral Participation = A FUNCTION OF(New Contributors, Mentoring Activities, Community Participation, Experienced Contributors)",
        "type": "flow",
        "purpose": "Models the process where newcomers gradually move from periphery to core through guided participation"
      },
      {
        "command": "Create variable: Ba (Knowledge Creation Context)",
        "mdl_fragment": "Ba (Knowledge Creation Context) = A FUNCTION OF(Community Participation, Knowledge Sharing, Tacit Knowledge Sharing, Explicit Knowledge Creation)",
        "type": "auxiliary",
        "purpose": "Represents the shared context for knowledge creation as per Nonaka's theory - the physical, virtual, and mental spaces where knowledge is shared"
      }
    ]
  },
  "statistics": {
    "additions_proposed": 4,
    "removals_suggested": 3,
    "new_variables": 3,
    "total_connections_after": 62
  },
  "updated_connections": [
    {
      "from": "Maintainer time",
      "to": "Issue Resolution Rate",
      "relationship": "positive"
    },
    {
      "from": "Projects's Explicit Knowledge",
      "to": "Explicit Knowledge Transfer (Documentation, Contributor's Guides)",
      "relationship": "positive"
    },
    {
      "from": "Issue Resolution Rate",
      "to": "Closed Issues",
      "relationship": "positive"
    },
    {
      "from": "Feedback",
      "to": "Open Issues",
      "relationship": "positive"
    },
    {
      "from": "Issue Creation Rate",
      "to": "Open Issues",
      "relationship": "positive"
    },
    {
      "from": "Issue Resolution Rate",
      "to": "Open Issues",
      "relationship": "negative"
    },
    {
      "from": "Experienced Contributors",
      "to": "PR Feedback",
      "relationship": "positive"
    },
    {
      "from": "New Contributors",
      "to": "PR Feedback",
      "relationship": "positive"
    },
    {
      "from": "PR Review Delay",
      "to": "PR Feedback",
      "relationship": "positive",
      "marked_for_review": true,
      "removal_reason": "Unsupported by theory - delays typically hinder legitimate peripheral participation by creating barriers to engagement and learning"
    },
    {
      "from": "Pull Request Under review",
      "to": "PR Feedback",
      "relationship": "positive"
    },
    {